#,Title,JPja,USen
1,Demo210_0_Text000,…戻ったか主よ,Ah. So you have finally returned.
2,Demo210_0_Text001,"マスターソードの力を余さず使いこなせる
肉体と精神力を主は手に入れた…","Your mind, body, and soul are now
ready to wield the Master Sword
at its full potential."
3,Demo210_0_Text002,じつに見事な成長じゃ！,You never fail to impress!
4,Demo210_0_Text003,"これで主は晴れて その剣の主となった
剣が発する聖なる輝きが良く似合うておる","Now you are truly one with that sword
of yours. I must say, its sacred glow
suits you well."
5,Demo210_0_Text004,儂は ここから主の道行を見守ろう…,"As ever, I shall watch over your journey
from here..."
6,Demo210_0_Text005,姫巫女も…,The princess...
7,Demo210_0_Text006,"おそらく ハイラルの姫巫女も
主の成長を祝福しておるはずじゃ…","I am certain Hyrule's princess is pleased
with your accomplishment as well..."
