#,Title,JPja,USen
102,Initial_RoyalShield,"……
その背中のモノは！
…王家の盾じゃない！
ここの小屋にも飾ってるんだけど
私が今まで出会った盾の中では
最高峰のデザインと滑りやすさよ！","*sigh...* Hey... What's that on
your back?!Oooh, a royal shield! I have one hanging
up in my cabin too. It's hands down the
best design for surfing I've ever seen!"
103,Initial_RoyalShield1,"……
その背中のモノは！
王家の盾じゃない！私が出会った盾の中では
最高峰のデザインと滑りやすさよ！","*sigh...* Hey... What's that on
your back?!Oooh, a royal shield! I have one hanging
up in my cabin too. It's hands down the
best design for surfing I've ever seen!"
104,Initial_SpikeShield,"……
その背中のモノは！
鋼鉄リザルシールドじゃない！ そのトゲが
エッジの効いた滑りには最適なのよ！","*sigh...* Hey... What's that on
your back?!It's a steel Lizal shield! That spike is
worth major style points for when you
want to look hard-core on the slope!"
105,Initial_SpikeShield1,"……
その背中のモノは！
鋼鉄リザルシールドじゃない！ そのトゲが
エッジの効いた滑りには最適なのよ！","*sigh...* Hey... What's that on
your back?!It's a steel Lizal shield! That spike is
worth major style points for when you
want to look hard-core on the slope!"
106,Initial_SunShield,"……
その背中のモノは！
七宝の盾！！ ゲレンデが溶けるほど
焦がれた銘品が今目の前に…！！","*sigh...* Hey... What's that on
your back?!A Daybreaker! Am I dreaming?!
I've wanted that shield so bad that I've
seen it in my dreams..."
107,Initial_SunShield1,"……
その背中のモノは！
七宝の盾！！ ゲレンデが溶けるほど
焦がれた銘品が今目の前に…！！","*sigh...* Hey... What's that on
your back?!A Daybreaker! Am I dreaming?!
I've wanted that shield so bad that I've
seen it in my dreams..."
108,LetsStart_01,"それじゃ早速 コースに行くわよ
ついてらっしゃい","Then let's get straight to the slopes.
Follow me!"
109,LetsStart_02,さて…競技内容の説明を聞いていく？,"Do you need a rundown on how this
works?"
110,LetsStart_03,"あら競技内容くらいは知っているのね！
手間がかからなくて良かったわ","Oh, so you already know what you're in
for. Suits me. I hate having to explain to
casuals anyway."
111,LetsStart_04,"それじゃ いい滑りを期待してるわ
準備はいいかしら？""位置について！","I wanna see you shred out there.
You ready? On your mark..."
112,NG_00,"え違うの？紛らわしい…
べ別に期待してたわけじゃないんだからね？","Really? Are...are you sure? I-it's not
like I was expecting visitors today."
113,NoPlay_00,"そうよね…現役の時はみんな あんなに
チヤホヤしてたのに世間って厳しいわね…","Right... I used to be a big deal back in
my day, but the world moves on fast."
114,NotHadEnoughRupee,"授業料が足りないみたいね…！
20ルピー用意してから出直してらっしゃい","Looks like you're too broke to afford the
instructor's fee. Come back when you
can scrape together 20 rupees."
115,Pouch_Check00,"ポーチの整理ができたみたいね！
はい！約束の盾よ！","Hey, look who made some room in their
pack! I got that shield I promised you
right here."
116,Pouch_Check01,"上級コース ゴール記念の盾を
あげたいんだけど…","I wish I could give you that prize shield
for the advance course I was holding
for you..."
117,Pouch_Check02,"まだ ポーチの整理ができていないみたいね…
渡すまで次の練習はお預けよ！","Buuuut you still haven't made any room
for it in your pack. So I'll keep holding
on to it for the next time you stop by!"
118,Pouch_Check03,それじゃあ小屋へ戻りましょうか,"C'mon, let's head back to the cabin."
119,Pouch_Check04,ポーチの整理ができたら声をかけてね！,"When you find some room in your pack,
let me know!"
120,Pouch_Check05,"渡した盾を使った滑り…
さっそく見せてくれるのね！","I want to see you shred on that shield
I gave you... Show me what you got!"
121,RefusePay_00,"あら残念ね！""元・プロに見てもらう
チャンスなんてなかなかないわよ！","Wow, OK. If you want to pass up the
chance to get tips from a former pro,
hey, I won't stop you."
122,Stop_00,あら どうしたの？,What's up?
123,Stop_01,"あら…もし途中でやめても
受け取ったルピーは返せないわよ？","Uh... You know I'm not giving your
rupees back, right?"
124,Stop_02,"中途半端で投げ出すのはもったいないけど…
また次回頑張って頂戴ね！","Feels like a waste to me, but all right.
Just promise me you'll come back
sometime and show me what you've got!"
125,Stop_03,じゃあ頑張って腕前を見せてちょうだいね！,"Great! Now get back out there, and show
me what you've got!"
126,TalkForPay_Beginner,"自分の将来に対して投資が出来る
アスリートとしての第一歩クリアね！","Smart choice. I always say, if you're not
willing to put your money where your
mouth is, how serious are you really?"
127,TellRupee_Beginner,"ふふふ…今のあなたの情熱
昔の私を思い出すわ！
ただし！元・プロの指導なんだから
モチロン タダじゃあないわよ？","Such enthusiasm! I haven't seen anyone
with passion like that since...well, me!But I'm not just any surfer-come-lately.
I was the BEST. And that means my
advice isn't free."
128,suremi_fire_shield1,"ちょっと！何してるの？！
やめてちょうだい！",Hey! What's the big idea?! Cut that out!
