#,Title,JPja,USen
1,Talk01,"色づいて落ち行く木の葉…""大厄災で落ちた砦…
何とも言えぬ哀愁が漂う風景だ……","Colorful leaves gently falling... A fort that
fell to the Great Calamity... Unspeakable
sorrow surrounds this landscape."
2,Talk03,"うむ この絵……
この泉と女神像には見覚えがあるぞ
ここから西に広がるキタッカレ平原にあった
遺跡がこんな場所だったはずだ","Hmm... I know I've seen that spring and
that Goddess Statue before...

There was a place like this at the
ruins in North Akkala Valley,
to the west of here."
3,Talk05,"ここからだと ほぼ真西だ
きっとすぐに見つけられるはずだぞ","It's pretty much directly west of here.
I'm certain you'll be able to find it
without any trouble."
