#,Title,JPja,USen
1,Talk_01,"やっぱりヴァーイミーツヴォーイは最高だね！
フロスさん！","I ask you, Furosa, is there anything
better than a taste of Noble Pursuit?"
2,Talk_02,"死にかけてたくせに
まったく…調子いいねぇ…
それでもう祠の調査はいいのかい？","You were at death's door and you ran
all the way here for that! Good grief... 
You're in incredible shape...
Does that mean you don't plan to
investigate that shrine anymore?"
3,Talk_03,"いや～ あんなしんどいとは
正直思わなかったよ","Definitely. I never dreamed that kind of
work would be so dull..."
4,Talk_04,"ったく…
性にあわないこと するからだよ","I'm not surprised you found it dull.
That sort of thing isn't really \""you.\"""
5,Talk_05,"私はやっぱり
ここで飲んだくれてるのが一番だよ～","Yeah, you know what really is \""me\""?
Drinking."
