#,Title,JPja,USen
1,"""0000""",聴かせて,Let's hear it.
2,"""0001""",今はいい,That's all right.
3,Npc_Musician_003_R_001,"天照す光""北西に輝くとき
塔の影が示す先より""天の光めがけ矢を放て","As light shines from the northwest skies,
From the tower's shadow an arrow flies."
4,Npc_Musician_003_R_005,勇者の試練 その地に目覚める,Pierce heaven's light to reveal the prize.
5,Npc_Musician_003_R_006,"きっと私には思いもよらないような
秘密が隠されているのでしょうね
では あなたの旅路に光がありますよう…","I still don't quite understand the lyrics, 
but knowing my teacher, they're the key
to revealing a secret.
Best of luck, and may the light illuminate
your path."
6,Npc_Musician_003_R_008,"これは失礼しました
詩に夢中になってしまいました……
この詩は今は亡き私の師匠が作ったものです100年ほど前に起きた大厄災……
これを鎮める勇者にささげる詩だそうです
100年経った今 まだ勇者は現れませんが……
いつかきっと現れると師匠は信じていました
いつか現れる勇者に この詩をお聴かせしたくて
日々 こうして練習をしています","Mm? Ah, forgive me. I was lost in a song
written by my late teacher.He wrote it for the hero who fell to the
Calamity 100 years ago...So much time has passed, and yet the
hero has not yet returned. But my
teacher always kept faith.
I hope to play the song for the hero
someday, so I practice it often."
7,Npc_Musician_003_R_009,"……
……","What if... No, but then..."
8,Npc_Musician_003_R_010,おや？,Hmm?
9,Npc_Musician_003_R_Near,ん～,♪Hmmm hm hmmm...♪
