#,Title,JPja,USen
1,"""0000""",読む,Read.
2,"""0001""",読まない,Don't read.
3,Book00,"朝から晩までウワサ好き ミツバやで！

『光る青いウサギ』

むかーし昔 ある腕利き猟師がいたそうな

あるとき猟の帰り道
彼は闇の中に動く光を見つけ
思わず矢を放った！
すると その場所にルピーが落ちていたそうじゃ
猟師は その後
光を見つけるたびに矢を放ち
大金持ちになったとさ

このお話単なる昔話て思うやろ？

最近森の中で「光る青いウサギ」を見たって
人が続出してんねん！！
ミツバの第六感がピーンってきたわ

この昔話に出てくる光って
絶対「光る青いウサギ」の事やろ！
ということは
見つけたら大金持ちになれるんちゃう？
これはオススメ度MAXやろ！
ミツバおススメ度 ★★★★★
あっ でもウチ…
弓矢全然使われへんかったわ…
なんや… テンション下がったわ
ミツバおススメ度 ★☆☆☆☆","Traysi here, bringing you the latest news
and gossip from morning to night!

Glowing Blue Bunny


A loooong time ago, there was a skilled
hunter.

On the way back from a hunt, he saw a
light moving in the darkness.

Without hesitation, he fired an arrow
toward it, and where it had been he
found a bunch of rupees.
From that day forward, whenever he saw
a similar light, he would fire an arrow
at it.
He always found rupees where his target
had been, and he grew quite rich.

Or so the story goes... I bet you think
this is just a myth, right?

Then what do you say about all the
people who claim to have seen a glowing
blue bunny in the forest lately?
You probably say, \""Oh, Traysi, thank you
for writing volume 6!\"" Sound about
right?
You should say that, because the blue
bunny is the light the hunter saw!

Finding it means finding lots and lots of
rupees! I can't endorse this bit of gossip
enough!
Traysi's Recommendation: ★★★★★


Wait, I don't know how to use a bow and
arrow... That really puts a damper on
things.
Traysi's Recommendation: ★☆☆☆☆"
4,BookFirst,『ウワサのミツバちゃん Vol.6』,Rumor Mill: Volume 6
