#,Title,JPja,USen
1,"""0000""",長すぎる眠りに…,I've been sleeping.
2,"""0001""",記憶がない,I lost my memory.
3,"""0002""",ミファー？,Mipha who?
4,"""0003""",分からない,Doesn't ring a bell.
5,"""0004""",準備した,I'm ready!
6,"""0005""",まだ準備してない,Not yet.
7,"""0008""",思い出した,I remember.
8,"""0009""",少しだけ…,Just a bit...
9,"""0010""",すみません…,I'm so sorry...
10,"""0011""",どうなったのでしょう？,What happened?
11,"""0012""",分かった,I'm ready.
12,"""0013""",本当にいいのか？,Are you sure?
13,"""0014""",退魔の剣？,What sword?
14,"""0015""",無くしたかも,Perhaps.
15,"""0016""",まかせろ,I'm on it!
16,"""0017""",もう一度聞かせて,Come again?
17,"""0018""",わかった！,I'm in. Let's do this!
18,"""0019""",実は…,"I, um..."
19,"""0020""",ミファーを思い出した,Mipha... I remember.
20,"""0022""",もちろんだ！,No problem!
21,"""0023""",一度撤退しよう,Let's retreat.
22,"""0024""",このまま続けよう,Never surrender!
23,"""0025""",ゼルダの声が聞こえた,I heard Zelda's voice.
24,"""0026""",ハイラル城で…,"Yes, in Hyrule Castle."
25,Npc_Zora003_F_001,"おおリンク！ よくぞ戻った！
待っておったゾヨ！","Link! You did well to survive your trial!
I have been awaiting your return!"
26,Npc_Zora003_F_002,"あれほど猛威をふるった豪雨が嘘のように止み
この里の危機は消え去ったゾヨ ！
ハイラルの大地が水没する心配は
もうなくなったゾヨー！","The violent downpour has disappeared,
as has the threat to Zora's Domain!
It is all little more than a bad dream now.
Thanks to your efforts, there is no longer
any danger of a great flood laying waste
to Hyrule!"
27,Npc_Zora003_F_003,"豪雨も止み神獣も戻った！
なんとめでたいゾヨ！","The heavy rains have stopped, and the
Divine Beast is our ally once again!"
28,Npc_Zora003_F_004,"そういえばリンク
ソナタは退魔の剣を持っておらぬが…
かつての記憶と共に
退魔の剣もなくしたゾヨか？","By the way, Link. I see you are without
your trusty blade...the sword that seals
the darkness.
Did you perhaps lose it when you lost
your memory?"
29,Npc_Zora003_F_005,"きっと このハイラルのどこかで
主が来るのを待っているにちがいないゾヨ","It is no doubt resting somewhere in
Hyrule even now...waiting for its
master to return."
30,Npc_Zora003_F_006,"ソナタが眠っておる間は
どこかで帰りを待っているはずゾヨ","It undoubtedly found a safe place
to wait for you...sleeping soundly,
just like its master."
31,Npc_Zora003_F_007,"そういえば あれも退魔の剣といったか…
迷いの森に名のある剣が眠ると聞く
ソナタが100年前に持っていた
退魔の剣そのものかどうかは知らぬゾラが…
行ってみるのも悪くない
迷いの森はここより西ハイラル城の北ゾラよ","Speaking of the sword that seals the
darkness... I hear that a legendary
blade now sleeps in the Lost Woods.
Mind that I cannot say with certainty
that it is the same blade you wielded
100 years ago.
Still, I advise you to go there and see it
for yourself. The Lost Woods are to
the west, north of Hyrule Castle."
32,Npc_Zora003_F_008,"リンク今回のソナタの働きには
ゾーラ一同心から感謝するゾヨ！","Link, all of the Zora thank you from the
depths of our hearts for your heroic
and selfless work!"
33,Npc_Zora003_F_009,"お前がリンクと共に神獣と戦ったこと…
父親として誇りに思うゾヨ
知らぬ間に そんなにたくましくなりおって…
もう ワシの跡取りとして申し分ないゾヨ！","As your father, I am proud of you
for fighting the Divine Beast
alongside Link.
You have grown much recently. I know
you will be a worthy heir when your
time comes."
34,Npc_Zora003_F_010,"…とはいえ退魔の剣を持つソナタの事
あまり使う機会は ないかもしれんが…
その剣は ソナタにしか扱えぬ伝説の剣
くれぐれも大切にするのだゾヨ","Oh...but I see you already awakened the
sword that seals the darkness. Perhaps
you do not have need of this after all.
What you have there is a legendary blade
that only you can wield. You must take
great care of it."
35,Npc_Zora003_F_011,むぅ やはり忘れておったかゾヨ…,Hm. So you have forgotten that as well...
36,Npc_Zora003_F_012,なんと！無くしてしもうたゾヨか！,What? Is it truly lost?!
37,Npc_Zora003_F_013,"あれは英傑のリーダーである
ソナタにしか扱えぬ剣","That is a legendary blade that only you,
the Hylian Champion, can wield."
38,Npc_Zora003_F_014,"ソナタが眠っておる間は
どこかの森で帰りを待っているはずゾヨ","I expect it was awaiting your return while
you slept, resting in a sacred forest
or some such."
39,Npc_Zora003_F_015,"リンク！
ソナタには礼を渡さねばならぬゾヨ！",Link! I must reward your efforts!
40,Npc_Zora003_F_016,…そして シド,"...And you too, Sidon."
41,Npc_Zora003_F_018,"ソナタが水の神獣を鎮めてくれたおかげで
このゾーラの里は救われた！
期待以上の働きをしてくれた ソナタに
民を代表して心から感謝の意を示したいゾヨ！","You appeased the Divine Beast Vah Ruta
and thusly saved Zora's Domain!

We are all truly grateful! What you did
for us is more than we could have
ever expected of you."
42,Npc_Zora003_F_019,"さあ あの宝箱の中のものを受け取ってくれ

あれはミファーがずっと愛用していた
形見のようなものゾヨ…
友好の証として ソナタに持っていてほしい
そして どうかいつまでも大切に…","Now then! I implore you to collect the
treasure inside that chest over there.

It was cherished by Mipha. A memento
of sorts. I would like you to have it as
a token of our friendship.
Please take good care of it."
43,Npc_Zora003_F_020,ジャブフフフッ！,"How glorious! Truly splendid!
Wah ha ha ha!"
44,Npc_Zora003_R_001,"む？ その姿！
ソナタは… ハイリア人？
まさか息子 シドに頼まれてきてくれたゾヨか？
よくぞ ここまで来てくださった！
して…""息子のシドはどこにおるかの？
一緒に来たのではないゾヨか？","Hm? Well, I'll be!
Are you not...a Hylian?

By chance, did my son, Sidon, ask you
to come here? I am so glad you could
make it!
So then... Where is Sidon?
Did he not come with you?"
45,Npc_Zora003_R_002,"おお ソナタは
ハイリア人ではないか？","Ah. You are a Hylian, are you not?"
46,Npc_Zora003_R_003,"おおっ
ソナタが シドの連れてきた ハイリア人？","Ah. You must be the Hylian that Sidon
brought here, correct?"
47,Npc_Zora003_R_004,"ん？ ソナタの腰のモノ…
それはシーカーストーン？！
んん？よく見たらソナタ…","Hm? That object upon your waist...
is that not a Sheikah Slate?!

HMMM?!Now that I have gotten a good look
at you, it is all too clear who you are..."
48,Npc_Zora003_R_005,"なんと！ どれだけ長き眠りに…
ワシのことを覚えとらん様子なのは そのせいか","Come again? Sleeping, you say...
Hm. Is that why you do not seem
to remember me?"
49,Npc_Zora003_R_006,"なんと！""記憶がないと？！","Come again? You say you have lost
your memory?"
50,Npc_Zora003_R_007,"我が娘 ミファーのことは
覚えておるゾヨ？","But surely you must remember my
precious daughter, Mipha, yes?
You do, do you not?"
51,Npc_Zora003_R_008,"まさかミファーのことも忘れてしまったと？

あんなに ソナタと仲のよかったミファーを
覚えておらんゾヨか？
この里の風景…","I cannot believe it... Have you truly
forgotten my dear Mipha as well?

You and Mipha were so close...
Yet you do not remember her?

Young hero... Please look upon the
beauty of Zora's Domain."
52,Npc_Zora003_R_010,"それにしても
知らずに英傑をつれてくるとは…","But first, it is worth noting how
remarkable it is that Sidon brought
a Champion here without realizing it!"
53,Npc_Zora003_R_011,"実は今 この里は水の神獣ヴァ・ルッタのせいで
存亡の危機に見舞われておるゾヨ
単刀直入に言うと…
ワシらだけでは どうにもならんゾヨ！
ソナタの力貸してはくれまいか？","Now then. Hero...I must inform you that
Zora's Domain is in danger of vanishing
because of Divine Beast Vah Ruta.
I shall do you the courtesy of speaking
bluntly. We alone cannot stop this beast.

Will you lend us your strength?"
54,Npc_Zora003_R_012,"ムズリ…
ゾーラのヒレ折れだなどと大げさなことを","Muzu, I expected more of you.
How can you still protest?"
55,Npc_Zora003_R_013,"…リンク…ルッタは水の神獣…
無限に水を生み出す力を持っておるゾヨ
最近突然水を吹き上げ出したせいで
この辺りは激しい雨が続いている…
もともと我らゾーラにとって水は空気も同然
それだけなら困ることもなかったゾヨが…
東にある貯水湖が あふれそうなのだ！もし貯水湖が決壊してしまったら
この里はもちろん
川下に住む者達にも甚大な被害がでるゾヨ","...Link...Divine Beast Vah Ruta has great power.
It has the unique ability to create an
endless supply of water.
Of late it has been mercilessly spouting
water into the air. As a result, this area
has been plagued by heavy rains.
For us Zora, water and air are as one,
so you would not think this would be
quite so critical of a problem.
Sadly, the rains have filled the eastern
reservoir nearly to the point of flooding.If the reservoir bursts, as it soon will,
I fear immense damage will befall not
only Zora's Domain...
but also the area downstream from us.
There, Hylian lives are in very
grave danger."
56,Npc_Zora003_R_014,"リンク ありがとうゾヨ！

我らの目的が ほぼ同じとは
これも運命なのかもしれぬな
善は急げというゾヨ
ソナタに コレを受け取ってほしいゾヨ","Thank you, Link. Truly.
We are in your debt.

Our goal is the same. That means our
meeting was nothing short of destiny.

Now then, allow me to offer you this gift
as a show of faith."
57,Npc_Zora003_R_015,"むぅ…
また神獣が吠えておるゾヨ…","Hmm... The Divine Beast is crying out
once again..."
58,Npc_Zora003_R_016,"水の神獣 ヴァ・ルッタ…ソナタらの姫 ゼルダ殿は厄災が現れる前に
神獣についても よく研究されておったゾヨ
ゼルダ殿の書かれた書物によれば
ルッタの肩に見える装置…
あれが電気によって
水を制御するカラクリらしいゾヨ
だが今は暴走して電気が流れておらんゾヨ","The Divine Beast Vah Ruta...Your princess, Zelda, often studied the
Divine Beasts. That is, in the time before
the Great Calamity.
According to her research, the orbs
located on Ruta's shoulders...

are mechanisms that can control
the water it generates. However,
they require electricity to work.
These orbs are clearly out of control
now because there is no electricity
coursing through to stop them."
59,Npc_Zora003_R_017,"そういえば…ルッタを鎮めるのに必要となる電気の矢を
ムズリに探しておくよう命じておいたが… 
出て行ってしまったゾヨ…","Hmm, but what shall we do now?I tasked Muzu with finding the
shock arrows we will need to
appease Vah Ruta.
But now he has rushed off in a huff..."
60,Npc_Zora003_R_020,"何かのきっかけで
思い出す事も あるかもしれんゾヨ 
できれば…","Well, perhaps your memory will return
in time.

I dearly hope so."
61,Npc_Zora003_R_021,"そうゾヨ
リンクは紛れもなき英傑！
今はこの里が…いや""ハイラル全土が
水に呑まれるかもしれぬ危機的状況！
ここは ゾーラもハイリア人もない
謙虚に ヒレを畳む時ゾヨ","Indeed! Link is a Champion,
through and through.

As things now stand, Zora's Domain...Nay! Perhaps all of Hyrule...is doomed
to be swallowed by the sea.

This is bigger than all of us, my friend.
Zora and Hylians alike must put aside
our differences and band together."
62,Npc_Zora003_R_022,むぅ ムズリめ…あれは我が娘ミファーの教育係だったゾヨ,"Hmph. That Muzu is not easily swayed
once his mind is set.You must understand... He was in charge
of educating my dear daughter, Mipha."
63,Npc_Zora003_R_023,"リンク
ムズリはおそらく下の広場にいるゾヨ
ソナタも行ってやってくれぬか…
説得には ソナタが必要ゾヨ","Link... Muzu is most likely at the
square down below.

Would you mind going down there?
I would like you to try to speak
with him."
64,Npc_Zora003_R_025,ハイリア人の英傑 リンクではないか！ワシを覚えておらんかの？！,"You are the Hylian Champion, Link!Do not tell me you have forgotten me..."
65,Npc_Zora003_R_026,"ハイリア人の英傑リンクが今ここに！
まさしく驚くべき出来事ゾヨ！
それにしても懐かしい…
ホレかつて幾度も会ったであろう
命運が尽きたと聞いていたが
生きておったゾヨのう！","I cannot believe it. The Hylian Champion,
Link, has appeared before us... We have
met numerous times, I'll have you know.
Ah... So many memories! My mind is
overflowing with nostalgia, my friend.

I had heard a terrible rumor that you had
fallen in combat, but it appears you
managed to survive. Extraordinary!"
66,Npc_Zora003_R_028,"シド･･･
アノ話をするつもりゾヨな･･･","Sidon... I suppose that means you are
going to tell him..."
67,Npc_Zora003_R_029,おお そうよな…,"Oh? Yes, of course."
68,Npc_Zora003_R_030,"ポーチがいっぱいゾヨ
ゾーラの鎧を渡すのは ポーチを空けた後ゾヨな","Link, your pouch appears to be full.
Please make some space in there so
I may gift you this Zora armor."
69,Npc_Zora003_R_032,"リンク""ソナタも大変であろうが
ワシの話を聞いてほしい","Link, I doubt not that you have endured
a great many trials. Still, I must ask you
to hear my plea."
70,Npc_Zora003_R_033,"シド""おまえも やるゾヨ！","That is quite a feat, my boy!"
71,Npc_Zora003_R_034,"それを着ていれば ハイリア人でも
我らゾーラのように滝登りができるゾヨ
どうか大切にな","So long as you wear this, you can
ascend waterfalls just like a Zora.

Please, take good care of it."
72,Npc_Zora003_R_035,"ミファーの像を見ても
何も思い出さんゾヨ？","Do you see that statue? Does gazing
upon Mipha's immortalized form still
not jog your memory?"
73,Npc_Zora003_R_036,"ワシら肉親と同様に ミファーのことを
心底大切に思ってくれておるのだ
大厄災で ミファーを失ったとき
ハイリア人嫌いが決定的になってしまったゾヨ
ムズリの失礼を許してやってほしいゾヨ","Naturally, she means a lot to him...
just as she means the world to us.

Ever since we lost her to the Calamity,
he has grown to despise Hylians.

I hope you can forgive his rudeness."
74,Npc_Zora003_R_037,"ワシは ゾーラ族の王 ドレファンであるゾヨ
よくぞ ここまで来てくださった！","I am King Dorephan, ruler of the Zora.
You did well to come all the way here!"
75,Npc_Zora003_R_038,よくぞ ここまで来てくださった！,You did well to come all the way here!
76,Npc_Zora003_R_039,"ワシは ゾーラ族の王
ドレファンであるゾヨ","I am King Dorephan, ruler of the Zora."
77,Npc_Zora003_R_040,"む？ リンク どうしたゾヨ？
なにやら キョロキョロしておったが…","Hm? What is the matter, Link?
You seem to be looking about
as though in a bother..."
78,Npc_Zora003_R_041,"なんと ゼルダ殿の声とな…！

ゼ ゼルダ殿は
生きておられるのかゾヨ？！","Lady Zelda's voice, you say?!


Lady Zelda...is still alive?!"
79,Npc_Zora003_R_042,"なんと なんと…！
そうであったか！
…100年前は
あのような結果になってしまったが
神獣の中に入り こちらの手に取り戻せば
ガノンを封印する手助けに なるやもしれんゾヨ","I do not believe it... She was alive this
whole time, just as you were!

The events of 100 years ago cannot be
altered, it is true.

But if we can regain control of the Divine
Beasts...they may yet prove useful in
sealing Calamity Ganon once and for all!"
80,Npc_Zora003_R_043,さっきの鳴き声のヌシ…,"The creature behind that roar
you just heard..."
81,Npc_Zora003_R_044,"なに？！

オヌシ ゼルダ殿の導きで
神獣の中に入り""鎮めようと思っていたのか！
ゼ ゼルダ殿は
生きておられるのかゾヨ？","Whaaat?!


Princess Zelda herself instructed you
to board the Divine Beast and appease
it from within?
So then...Princess Zelda is still alive?"
82,Npc_Zora003_R_045,ジャブフフフッ！,Wah ha ha! That is a good one!
83,Npc_Zora003_R_046,"シドがゾーラの里に来てくれる
ハイリア人を探しておったが
まさか ソナタから訪れてくれるとは…
まるで何かが導いてくれたようゾヨ…","Sidon was looking for a Hylian to bring
to Zora's Domain.

And now you have come...as if led by
something."
84,Npc_Zora003_R_Near,むぅう…,Hmm...
85,Npc_Zora003_S1_001,"リンク
ムズリはおそらく下の広場にいるゾヨ
ソナタも行ってやってくれぬか…
説得には ソナタが必要ゾヨ","Link... Muzu is most likely at the
square down below.

Would you mind going down there?
I need you to convince him to fulfill
his duty."
86,Npc_Zora003_S1_002,"おお リンク！
さっき渡せなかった これを渡しておくゾヨ","Ah, Link! I was unable to give this
to you earlier, so please take it
now, along with my best wishes."
87,Npc_Zora003_S1_003,"おおリンクよ
ソナタ まだポーチがいっぱいなので…
ポーチに空きを作ってから また来るゾヨ","Oh. Link... It seems your inventory is full.


Please return after you have made
some room."
88,Npc_Zora003_S1_004,"そのゾーラの鎧は我が娘ミファーが丹精込めて
作り上げたものゾヨ
それを着ていればハイリア人でも
我らゾーラのように滝登りができるゾヨ
大切にしてやってくれゾヨ","My daughter, Mipha, put her heart and
soul into making that Zora armor.

So long as you wear it, even a Hylian
like yourself will have the power to
ascend waterfalls like a Zora.
Please take good care of it."
89,Npc_Zora003_S1_005,"なんと ムズリのヤツめ

ソナタが ミファーの想い人であると証明せねば
協力できぬなどと言ってるゾヨか？
何かゾーラの鎧がソナタのものと証明する
方法はないものか…","Muzu... What am I to do with him?


He insists he will not cooperate unless
you prove you are the one Mipha had
feelings for.
If only there was a way to prove that
this Zora armor is rightfully yours..."
90,Npc_Zora003_S2_001,"神獣の鎮め方は聞いたゾヨな？
ならば東の貯水湖にシドがいるはずなので
合流して協力し合って
水の神獣を鎮めて欲しいゾヨ","You were informed how to appease the
Divine Beast, were you not? Sidon can
be found at East Reservoir Lake.
I ask that you meet up with him and do
all you can to calm the Divine Beast."
91,Npc_Zora003_S2_003,"おお！思い出したゾヨか！
それは良かった良かった！",You remember! That is wonderful!
92,Npc_Zora003_S2_004,"いやいや！ ソナタは悪くない！
全ては憎き厄災ガノンの仕業ゾヨ！","No, please do not apologize. It is not
your fault. All of this is the despicable
work of Calamity Ganon."
93,Npc_Zora003_S2_005,"ミファーの行方？
それは ワシにも分からぬゾヨ…","You mean...what happened to Mipha?
Not even I know that."
94,Npc_Zora003_S2_006,"あの時四体の神獣が厄災ガノンに操られ
乗っていた英傑は閉じ込められてしまった…
それ以降誰一人として帰ってきておらぬ
神獣の中で一体 どのような事があったのか…
結果を知らぬ事が むしろ希望…
ワシらはまだ無事を祈る事ができるゾヨ","Calamity Ganon took control of the
four Divine Beasts...and trapped
the Champions inside of them.
Since then, not a single one of them has
returned. It pains me to think what must
have happened.
All I can do is hope and pray, though I
am well aware of the odds that anyone
could have survived something like that."
95,Npc_Zora003_S2_007,"おお！少しだけでも思い出したゾヨか！
それは良かった！","I see! Well, even if you only remember
her a little, that is better than nothing.
It warms my heart to hear it."
96,Npc_Zora003_S2_008,"ミファーが英傑に選ばれて出て行った時は
誇らしくもあったが寂しくもあったゾヨ…
それが水の神獣を厄災ガノンに操られて
あんな事になってしまって…
ワシはあの時 ミファーをもっと強く
引き止めるべきだったのかもしれん…","I was so proud when Mipha was chosen
as our Champion...but I was also quite
distressed about it.
When Calamity Ganon took control of
Divine Beast Vah Ruta...it all happened
so fast.
I cannot help but feel that I should have
tried harder to keep Mipha from harm...
I should not have let her go."
97,Npc_Zora003_S2_009,"ミファー達英傑が神獣の中で
どうなってしまったのか…
わからぬ事が むしろ希望ゾラか…","What befell my dear Mipha and the other
Champions within those Divine Beasts?

Sadly, I have no way of knowing.
I can only hope that by some
miracle they are still alive."
98,Npc_Zora003_S2_010,"おお！雨が止んでいるゾヨ！
リンク！ ソナタは神獣を鎮めたゾヨか？！
さすがは英傑リンクだゾヨ！
ワシにはもはや感謝の言葉しかないゾヨ！
ゾヨッ！","What is this?! The rain has stopped!
Link! Were you actually able to
appease the Divine Beast?!
Link, you are a true Champion!
I am grateful beyond words!"
99,Npc_Zora003_S2_011,"…ところで ワシの娘 ミファーのことは
思い出したゾヨ？","By the way...did you ever regain your
memories of my daughter, Mipha?"
100,Npc_Zora004_F_001,"お前ハイリア人なのにすごいゾラな！
今までの認識を改めさせてもらいたい！
これからは他の種族とも
もっと交流を持つようにするゾラよ！","You are rather incredible for a Hylian!
I will have to rethink my preconceptions
about you people.
Yes, perhaps people who are not Zora
are not so hopeless after all! I am eager
to learn more about other ways of life."
101,Npc_Zora004_F_002,"…リンク
お前に辛く当たって すまんかったゾラ
お前も ミファー様のことを
考えてくれていたのゾラな…
元老院の面々も
ヒレを畳んで感謝しておるゾラ
ワシら老人の多くは
ハイリア人を誤解していたのかもしれぬ
むしのいい話だが もし許してくれるならば
こんなに嬉しいことはないゾラ…","Link... I must sincerely apologize for
my harsh treatment of you.

That whole time, you were thinking of
Hyrule's and Lady Mipha's well-being,
just like the rest of us.
All of the members of our council humbly
fold our fins back in gratitude, along with
the rest of our people.
Perhaps the older generation of Zora,
myself included, misunderstood Hylians
after all. It would seem so.
That said, I would be overjoyed if you
could find it in your heart to forgive me.
If not now, then perhaps one day."
102,Npc_Zora004_F_Near,おお！ リンク！,Link!
103,Npc_Zora004_R_001,"お待ちくだされドレファン王！ハイリア人に助けを求めるなど
ゾーラのヒレが折れるというもの！","King Dorephan! My liege!
Please do not speak so!To ask a Hylian for help... Why, the very
thought of it curls my fins!"
104,Npc_Zora004_R_002,"ドレファン王は もうお忘れになられたゾラ？！
ハイリア人どもは信用できませぬ！！
100年前古代文明の力なぞ持ち出して
ハイラルを こんなにしてしまったのですゾ！","Have you forgotten already, my king?!
We cannot trust these lowly Hylians!

A hundred years ago, they abused the
power of an ancient civilization and
turned Hyrule into what it is today!"
105,Npc_Zora004_R_003,"ドレファン王！！ゾーラの鎧を渡すのですか？！それは代々ゾーラ族の王女が
将来ムコになる男に渡す誓いの鎧！
ミファー様が自らの手で作られた
大切なモノですゾ！！","King Dorephan!!Surely you do not really intend to give
this outsider the Zora armor!Countless generations of Zora princesses
have gifted that armor to the one they
have sworn to marry!
Princess Mipha made that one there with
her own hands! It is far too important
to entrust to a shady Hylian!"
106,Npc_Zora004_R_004,"あんまりです！
ワシは納得いきませんゾ！","This is just too much, my liege! 
I do not understand it one bit!"
107,Npc_Zora004_R_005,しかも…,And that is not the least of it!
108,Npc_Zora004_R_006,"しかも ミファー様まで
帰らぬ人となってしまった…","It is their fault that Lady Mipha was lost
to us..."
109,Npc_Zora004_R_007,"それを英傑であったといえ なんの関係もない
この男に渡すなど なんたること！","He may be a Champion, but Mipha had
no such relationship with him. So why
should HE receive such an honor?"
110,Npc_Zora004_R_008,ななッ？！,What?!
