#,Title,JPja,USen
1,QL_CarryingBlueFireEXMini_Camera,,
2,QL_CarryingBlueFireEXMini_Carry,"青い炎をかまどに点火した事で
ハテノ古代研究所の勇導石が可動し始めたようだ

点火した事を所長に報告して
シーカーストーンを 修理してもらおう","The blue flame in the furnace is now
powering the Hateno Ancient Tech Lab's
Guidance Stone.

Reportto the director so that she can repair
your Sheikah Slate."
3,QL_CarryingBlueFireEXMini_Desc,"インパの話によると ゼルダが道しるべとして
残してくれたシーカーストーンは
完全な物ではないらしい…

ハテノ村のハテノ古代研究所にいる所長が
シーカーストーンに詳しいようだ

マップを頼りに所長を訪ねてみよう","According to Impa, the Sheikah Slate that
Zelda left to guide you is incomplete.

Thedirector at the Hateno Ancient Tech Lab
in Hateno Village may know a way to restore
the Sheikah Slate's missing components.

Use the map to find the location of the
Hateno Ancient Tech Lab and itsdirector."
4,QL_CarryingBlueFireEXMini_Finish,"シーカーストーンの基本アイテムが復活した事を
インパに報告した！

アルバムに入っている写し絵は
100年前にゼルダが残した「想い出」だという

ゼルダが残した「想い出」を巡り
100年前の記憶を呼び戻そう！","You let Impa know that the basic runes of the
Sheikah Slate have been restored.

She told you that the pictures in the album are
Zelda's memories from 100 years ago.

Visit the various spots shown in the images
Zelda left behind to recall your own memories
from that era!"
5,QL_CarryingBlueFireEXMini_Fired,"プルアにシーカーストーンを修理してもらう事で
100年前の基本アイテムが復活した

その基本アイテムの1つであるウツシエで 
プルアを撮影してみよう！","Purah has fixed the Sheikah Slate, restoring
the last of itsbasic runesfrom 100 years ago.

Snap an image of Purah using theCamerarune!"
6,QL_CarryingBlueFireEXMini_Name,ゼルダの道しるべ,Locked Mementos
7,QL_CarryingBlueFireEXMini_Permit,"ハテノ古代研究所の所長によれば
今は勇導石が動いていないため
シーカーストーンは修理できない と言われた
研究所の外壁にあるかまどに青い炎を灯せば
勇導石は動き出すらしい

ハテノ村内にある古代炉から
青い炎を運んでかまどに点火しよう","The Hateno Ancient Tech Lab's director can't
fix the Sheikah Slate until the Guidance Stone
is operational again. The only way to power
the Guidance Stone is to light the furnace on
the outer wall of the tech lab with a blue flame.

Carry theblue flame from the ancient furnace
in Hateno Village to the tech lab, and use it to
light the lab'sfurnace."
8,QL_CarryingBlueFireEXMini_Repaired,"ウツシエでプルアを撮影する事に成功した！

プルアが言うには
アルバムの中には既に
過去の写し絵が含まれているようだ

これは何を意味するのか？
カカリコ村のインパに聞いてみよう","You proved the Camera works again by
capturing an image of Purah!

According to Purah, the album already has
pictures from the past in it.

Where could these have come from?Impa in
Kakariko Village may have the answer."
