#,Title,JPja,USen
1,QL_CursedStatue_Desc,"『呪われし石像 闇の光が宿るとき その眼を貫け
 さすれば封印されし試練は 解き放たれる』

自称考古学者のカリーユから教えてもらった
古の詩の謎を解き封印された試練を解き放とう","\""When a dark light resides in the cursed
statue's eyes, pierce its gaze to purge the seal
from the shrine.\""

You heard this from Calip, the self-proclaimed
archaeologist. Solving the ancient song's riddle
will reveal the hidden shrine."
2,QL_CursedStatue_Game,"『呪われし石像 闇の光が宿るとき その眼を貫け
 さすれば封印されし試練は 解き放たれる』

夜に光る石像の眼を矢で貫き
古代の祠を出現させた","\""When a dark light resides in the cursed
statue's eyes, pierce its gaze to purge the seal
from the shrine.\""

You fired an arrow into the glowing eyes of the
statue, and the ancient shrine was revealed."
3,QL_CursedStatue_Name,呪われし石像,The Cursed Statue
