#,Title,JPja,USen
1,QL_DokuroEye_Desc,"ジェリンが言うには
ドクロ池の左目に古代の祠がある との事

断崖絶壁なので
たどり着くのは至難の業らしい…","Jerrin told you of an ancient shrine atop
theleft eye of Skull Lake.

However, the sheer cliffs surrounding it may
make it next to impossible to reach..."
2,QL_DokuroEye_Finish,"ドクロ池の左目の頂上で
古代の祠を発見した

ジェリンの言う
たどり着くのは至難の業
と言う意味が分かったような気がする","You gained entry into the ancient shrine atop
the left eye of Skull Lake.

You understand now what Jerrin meant when
she said that the real trial was getting there."
3,QL_DokuroEye_Name,ドクロの左目,The Skull's Eye
