#,Title,JPja,USen
1,QL_GanonQuest_Desc,"ハイラル王の霊が言うには
この国は今滅亡の危機に瀕しているのだという…

ハイラル城で厄災ガノンの力を抑え続けている
ゼルダ姫の力が限界に達したその時…
厄災ガノンが完全に復活し終わりを迎えてしまう

それまでにゼルダ姫を救うことが出来るだろうか…","The ghost of King Rhoam told you that
Hyrule is on the brink of annihilation.

Princess Zelda is currently fighting to contain
Calamity Ganon inside Hyrule Castle, but her
power cannot keep him at bay forever.
Eventually, Ganon will regain his full
strength and destroy the world.

Your ultimate task is to aid Princess Zelda in
defeating Ganon before that can happen."
2,QL_GanonQuest_Finished,"不要？
ガノンの形態によってステップを分けた方がいいかも","ふよう不要？
ガノンのけいたい形態によってステップをわ分けたほう方がいいかも"
3,QL_GanonQuest_Name,ガノン討伐,Destroy Ganon
