#,Title,JPja,USen
1,QL_HatenoMini_CameraBoy_Desc,"シーカーセンサー＋は
ハイラル図鑑に登録されている物なら
何でも探知できるらしい
習うより慣れろ と言う訳で シモンからお題が出た

ハテノ古代研究所の裏にある
ポカポカダケをウツシエで撮影したら
シモンに報告しよう","The Sheikah Sensor + can detect anything
already registered in the Hyrule Compendium.
To demonstrate the possibilities, Symin gave
you some fieldwork.

Use the Camera to register asunshroom
behind the Hateno Ancient Tech Lab, and then
report back to Symin."
2,QL_HatenoMini_CameraBoy_Finish,"ポカポカダケを3個 シモンに持って行った

普段から色んな物をウツシエで撮り
ハイラル図鑑に登録しておけば
シーカーセンサー＋の探知で
必要な物を見つけやすくなるだろう","You gave Symin the three sunshrooms he
requested.

Symin helped you see how valuable registering
things to your Hyrule Compendium can be.
If you have an item registered in your
compendium, it's easy to find with the
Sheikah Sensor +."
3,QL_HatenoMini_CameraBoy_Name,ウツシエとシーカーセンサー,Sunshroom Sensing
4,QL_HatenoMini_CameraBoy_Shot,"ハイラル図鑑のポカポカダケを探す物に設定すれば
シーカーセンサー＋が
近くのポカポカダケを探知してくれるらしい

その機能を使って
北のエキスパの森に自生している
ポカポカダケを3個手に入れて シモンに渡そう","Now that you've registered a sunshroom in the
Hyrule Compendium, the Sheikah Sensor + can
detect sunshrooms wherever you are.

Go north of Hateno Village toRetsam Forest,
and findthree wildsunshrooms there.
When you have all three, turn them over
to Symin."
