#,Title,JPja,USen
1,QL_Kakariko_Cha_001_Desc,"「今日の献立は ゴーゴー野菜クリームスープ！」
と意気揚々と鍋に向かったココナだが
材料のゴーゴーニンジンを買い忘れ
途方に暮れていた
ゴーゴー野菜クリームスープ は妹プリコの大好物
このままではココナにもプリコにも
悲しい顔をさせてしまう
ゴーゴーニンジンさえあれば…","Today's special is hasty veggie cream soup!
At least, that's what Koko had in mind, but she
forgot to stock up onswift carrots, the key
ingredient. 

Hasty veggie cream soup is her little sister
Cottla's favorite meal, and Koko hates to see
her cry. If only she had someswift carrots..."
2,QL_Kakariko_Cha_001_Finish,"材料のゴーゴーニンジンを買い忘れ
途方に暮れていたココナだが
ゴーゴーニンジンを無事手に入れ
ゴーゴー野菜クリームスープを作ることができた！
ココナの顔に笑顔が戻った
きっとプリコも喜んでくれることだろう！
/////レシピメモ/////
ゴーゴーニンジン岩塩 フレッシュミルク","Koko was panicking after forgetting to stock up
on swift carrots for the hasty veggie cream
soup. But now that she has the ingredients
she needs, there's a big smile on both Koko's
and Cottla's faces.

 \t/////Koko's Recipe Corner/////
One serving of hasty veggie cream soup:

Add rock salt and fresh milk to a bowl of
swift carrots. Heat and stir to taste."
3,QL_Kakariko_Cha_001_Name,ココナ′ｓ キッチン,Koko's Kitchen
