#,Title,JPja,USen
1,QL_KorokMini_UMAShiren_Desc,"ピーカンからルミーの
姿を見せてほしい！と頼まれた
絵でも何でも いいらしい

ルミーは全身が光り輝く
不思議な生き物のようだ","Peeks really wants to see what aBlupeelooks
like. Even a picture will do.

Apparently the Blupee is a mysterious 
creature that glows brightly as it scampers
around."
2,QL_KorokMini_UMAShiren_Finish,"ピーカンに
ルミーの写し絵を見せてあげた

このルミーは
矢を当てると ルピーを落としてくれる
珍しい生き物のようだ","You showed Peeks a picture of a Blupee.


The Blupee is a rare glowing creature that drops
rupees when you shoot it with an arrow."
3,QL_KorokMini_UMAShiren_Name,ぴかぴかのルミー しれん,Legendary Rabbit Trial
