#,Title,JPja,USen
1,QL_Kakariko_Ch_Cooking3_Desc,"日頃仕事で疲れている父 ドゥランのために
『カチコチ肉詰めカボチャ』を作ろうと
意気揚々と鍋に向かったココナだが
材料のケモノ肉を切らし 途方に暮れているようだ
ケモノ肉を手に入れるためには
ケモノを狩ってこなければならない
子供には無理そうだ","Koko donned her apron and prepared to
dish up a tough meat-stuffed pumpkin for
her exhausted father, Dorian.

Without anymeat, though, this chef's in a bind.
She needs a skilled hunter to procure some
meatfor her."
2,QL_Kakariko_Ch_Cooking3_Finish,"日頃仕事で疲れている父ドゥランのために
『カチコチ肉詰めカボチャ』を作ろうとした
ココナだったがケモノ肉を切らし 途方に暮れていた
しかし ケモノ肉を持ってきてあげたことで
栄養満点の料理を作れたようだ
ココナの顔から笑みがこぼれた
/////レシピメモ/////
お肉（なんでもOK） ヨロイカボチャ","Koko donned her apron and prepared to
dish up a tough meat-stuffed pumpkin for
her exhausted father Dorian. With the meat
you brought her, she served her father a
revitalizing tough meat-stuffed pumpkin.

 \t/////Koko's Recipe Corner/////
One tough meat-stuffed pumpkin :

Hollow out a fortified pumpkin and add any
kind of meat. Bake until firm."
3,QL_Kakariko_Ch_Cooking3_Name,ココナ′ｓ キッチン３,Koko Cuisine
