#,Title,JPja,USen
1,QL_RitoMini_IceGolem_Beated,"ブリザー谷のガチロックを討伐した！
リトの村の門番 ギザンもきっと驚くことだろう

さっそくギザンに報告しよう","You defeated the Frost Talus at
Coldsnap Hollow!Gesane at Rito Village
will surely be pleased once you report
back to him."
2,QL_RitoMini_IceGolem_Desc,"リトの村の門番ギザンが見たというガチロック
ブリザー谷の方で見かけたらしいが…

ブリザー谷のガチロックを見かけたら
戦いを挑んでみよう","Gesane, a Rito Village guardsman, said he 
saw a frost Talus over atColdsnap Hollow.

If you encounter aFrost Talus in your
travels there, be sure to destroy it."
3,QL_RitoMini_IceGolem_Finish,"ブリザー谷のガチロックを討伐したことを
リトの村の門番 ギザンに報告した

驚いたギザンからお礼のルピーをもらった","You told the guardsman Gesane at Rito Village
that you destroyed the Frost Talus in
Coldsnap Hollow.

Gesane offered you rupees as thanks,
which you gracefully accepted."
4,QL_RitoMini_IceGolem_Name,ブリザー谷のガチロック,Face the Frost Talus
