#,Title,JPja,USen
1,QL_SeekerEye_Desc,"タバンタ大橋馬宿のゴーグには
遠くに見える山の壁面の一部が
何やら人工的な物に見えるようだ

あそこには いったい何があるのだろう？","Geggle at the Tabantha Bridge Stable thinks
that a certain section of the cliff face in the
distance looks man-made.

Just what could be hiding there?"
2,QL_SeekerEye_Finish,"タバンタ大橋馬宿のゴーグが
見ていた場所に行ってみると
絶壁に描かれた文様があった

その中心に電気の矢を撃ちこむと
古代の祠が出現した！","When you tried going to the spot that Geggle
pointed out to you, you noticed a design
etched into the cliff.

When you shot a shock arrow at the center of
the image, an ancient shrine appeared!"
3,QL_SeekerEye_Name,絶壁の文様,Cliffside Etchings
