#,Title,JPja,USen
1,QL_TreasureHunt01_Desc,"隠れコログが近くにいると教えてくれる
コログのお面 というものがあるらしい

森の馬宿に そのウワサが書かれた
「ウワサのミツバちゃん Ex増刊号」が
置かれているそうだ","Rumor has it there's an item called the
Korok Mask that has the power to alert its
wearer when a Korok is hiding nearby.

Apparently theWoodland Stable has a copy of
Super Rumor Mill EX, which details some rumors
about this rare mask."
2,QL_TreasureHunt01_Finish,"迷いの森にある恐ろしげな木の洞で
コログのお面を見つけた！

コログのお面を被って歩くと
近くに隠れたコログがいれば教えてくれるらしい","You found theKorok Mask in the spooky tree's
hollow within the Lost Woods!

The Korok Mask will inform you when a Korok
is hiding nearby."
3,QL_TreasureHunt01_Name,Ｅｘ 奇妙なお面のウワサ,EX Strange Mask Rumors
4,QL_TreasureHunt01_Step01,"ウワサのミツバちゃん Ex増刊号Vol.1を読んだ
本によると コログのお面という
魂が宿った道具があるらしい

コログのお面が入った宝箱は進む者を迷わす森の
恐ろしげな木の洞に隠されているそうだ
その森を見つけて宝箱を探そう！
何やら便利な探し方も あるらしいが…","You read Super Rumor Mill EX: Volume 1!
According to this special issue, there are
rumors of an item called the Korok Mask
that has been inhabited by a friendly spirit.

The treasure chest containing the Korok Mask
is hiddenin the hollow of a terrifying tree in a
forest that causes those who enter to lose their
way. Find that forest and locate the treasure
chest! It also seems there's a convenient way
to search for it..."
