#,Title,JPja,USen
1,QL_TreasureHunt_touzoku02_Desc,"ハイラル王家秘蔵の歴史的価値の高い衣装が
ラムダという盗賊に奪われていた
そのうちの１つは黄昏の冠 と呼ばれている

その隠し場所を記した手記が
ハイラル宿場町跡地のどこかにあるらしい","The royal family of Hyrule collected historically
significant outfits, but they were stolen by a
bandit named Misko. One of the items stolen
was a helmet of twilight...

There's a journal that places the location of this
treasure somewhere in theOutpost Ruins..."
2,QL_TreasureHunt_touzoku02_Finish,"『黄昏の勇者と共に語り継がれし影の女王の冠は
ヒメガミ川水に浸かりし神殿の跡』

賢者の神殿跡に埋められた宝箱の中から
ミドナの冠を手に入れた！","\""The princess of twilight, whose stories
are handed down alongside those of
the Hero of Twilight...
Her helmet can be found at the
temple ruins soaked in the waters
of Regencia River.\""

You found the treasure that was hidden
at Sage Temple Ruins and obtained
Midna's Helmet!"
3,QL_TreasureHunt_touzoku02_Name,Ｅｘ ラムダの秘宝 黄昏の冠,EX Treasure: Twilight Relic
4,QL_TreasureHunt_touzoku02_Step01,"『黄昏の勇者と共に語り継がれし影の女王の冠は
ヒメガミ川水に浸かりし神殿の跡』

ラムダの手記Exに黄昏の冠を
隠した場所が記されていた
水に浸かりし神殿の跡 とは…？","\""The princess of twilight, whose stories
are handed down alongside those of
the Hero of Twilight...
Her helmet can be foundat the
temple ruins soaked in the waters
of Regencia River.\""

Misko's EX Journal gives the location of the
helmet of twilight...but where could these
water-soaked ruins be?"
